{
  "id": "math_4a44c2d45a3de3fe",
  "source": {
    "image_file": "1.jpg",
    "page": null,
    "problem_number": null
  },
  "subject": null,
  "unit": null,
  "problem_type": "other",
  "difficulty": "standard",
  "original_text": "次の総数を求めよ。 (1) 10人の区別できる人から 4 × 100m リレーのチームを作るとき、その総数 (2) 10人の区別できる人から 4人の委員を選ぶ総数 (3) 10人の区別できる人から 1人の学級委員長と 3人の委員を選ぶ総数 (4) 3個の a, 4個の b, 5個の c を並べる順列の総数 (5) 3個の a, 4個の b, 5個の c, 2個の d, 1個の e, 1個の f を並べる順列の総数、ただし、左から d, d, e, f はこの順番であるとする。",
  "question": "次の総数を求めよ。 (1) 10人の区別できる人から 4 × 100m リレーのチームを作るとき、その総数 (2) 10人の区別できる人から 4人の委員を選ぶ総数 (3) 10人の区別できる人から 1人の学級委員長と 3人の委員を選ぶ総数 (4) 3個の a, 4個の b, 5個の c を並べる順列の総数 (5) 3個の a, 4個の b, 5個の c, 2個の d, 1個の e, 1個の f を並べる順列の総数、ただし、左から d, d, e, f はこの順番であるとする。",
  "givens": [],
  "answer_format": {
    "type": "free_text",
    "latex_template": null,
    "choices": null
  },
  "steps": [
    {
      "order": 1,
      "instruction": "(1) 設定: 10人の区別できる人から 4人を選び、順序を付けて 4×100m リレーのメンバーを作る。これは 10P4 = 10×9×8×7 の順列。",
      "input_type": "formula",
      "expected": "10P4 = 5040",
      "feedback": null
    },
    {
      "order": 2,
      "instruction": "答え(1): 5040",
      "input_type": "numeric",
      "expected": "5040",
      "feedback": null
    },
    {
      "order": 3,
      "instruction": "(2) 10人から 4人を選んで委員を作る（順序なし）. 10C4 = 210.",
      "input_type": "formula",
      "expected": "C(10,4) = 210",
      "feedback": null
    },
    {
      "order": 4,
      "instruction": "答え(2): 210",
      "input_type": "numeric",
      "expected": "210",
      "feedback": null
    },
    {
      "order": 5,
      "instruction": "(3) 1人を学級委員長として選び、残りから 3人を委員に選ぶ。総数は 10 × C(9,3) = 840。",
      "input_type": "formula",
      "expected": "10 * C(9,3) = 840",
      "feedback": null
    },
    {
      "order": 6,
      "instruction": "答え(3): 840",
      "input_type": "numeric",
      "expected": "840",
      "feedback": null
    },
    {
      "order": 7,
      "instruction": "(4) 3個の a, 4個の b, 5個の c を並べる順列: 12!/(3!4!5!) = 27720.",
      "input_type": "formula",
      "expected": "12!/(3!4!5!) = 27720",
      "feedback": null
    },
    {
      "order": 8,
      "instruction": "答え(4): 27720",
      "input_type": "numeric",
      "expected": "27720",
      "feedback": null
    },
    {
      "order": 9,
      "instruction": "(5) 16個の字を、2個の d, 1 個の e, 1 個の f を含む 3a,4b,5c,2d,1e,1f の並べ方。左から d,d,e,f はこの順番。総数は 16!/(3!4!5!2!) ÷ 12 = 50,450,400.",
      "input_type": "formula",
      "expected": "16!/(3!4!5!2!) / 12 = 50450400",
      "feedback": null
    },
    {
      "order": 10,
      "instruction": "答え(5): 50450400",
      "input_type": "numeric",
      "expected": "50450400",
      "feedback": null
    }
  ],
  "final_answer": "5040; 210; 840; 27720; 50450400",
  "hints": [
    "リストアップして個数を数える考え方",
    "多重度の分解と順序制約を分けて考える"
  ],
  "ui_components": [
    "step_progress",
    "hint_button",
    "keyboard",
    "formula_tray",
    "popover_explanation"
  ],
  "confidence": 0.8
}
